{
  "$schema": "https://json-schema.org/draft/2020-12/schema",
  "$id": "https://schemas.vev.software/fabric/v1/authorization-request.schema.json",
  "title": "AuthorizationRequest",
  "type": "object",
  "additionalProperties": false,
  "required": ["tenant", "principal", "action", "resource"],
  "properties": {
    "tenant": {
      "type": "object",
      "additionalProperties": false,
      "required": ["tenantId"],
      "properties": {
        "tenantId": { "type": "string", "minLength": 1 }
      }
    },
    "principal": {
      "type": "object",
      "additionalProperties": false,
      "required": ["principalId", "roles"],
      "properties": {
        "principalId": { "type": "string", "minLength": 1 },
        "displayName": { "type": ["string", "null"] },
        "roles": {
          "type": "array",
          "items": { "type": "string" }
        },
        "claims": {
          "type": "object",
          "additionalProperties": { "type": "string" }
        }
      }
    },
    "action": {
      "type": "string",
      "minLength": 1
    },
    "resource": {
      "type": "object",
      "additionalProperties": false,
      "required": ["value"],
      "properties": {
        "value": { "type": "string", "minLength": 1 }
      }
    }
  }
}
